564970,ÐLBD Quảng Huế,"Thôn Quảng Quế, Xã Đại Hoà, Huyện Đại Lộc"
566240,GD cấp 3 Cây Sanh,"Thôn Cây Sanh, Xã Tam Dân, Huyện Phú Ninh"
564440,BĐVHX Điện Hồng,"Thôn 10, Xã Điện Hồng, Huyện Điện Bàn"
566020,BĐVHX Zuôih,"Thôn Brum B, Xã Zuôih, Huyện Nam Giang"
566300,BĐVHX Tam Lộc,"Thôn 2, Xã Tam Lộc, Huyện Phú Ninh"
566040,BĐVHX Tà Bhing,"Thôn Bà Xua, Xã Tà BHing, Huyện Nam Giang"
562750,BĐVHX Duy Hải,"Thôn 1, Xã Duy Hải, Huyện Duy Xuyên"
565801,BĐVHX Lăng,"Thôn Nal, Xã Lăng, Huyện Tây Giang"
565520,KT cấp 2 Đông Giang,"Thôn Ngã Ba, Thị Trấn PRao, Huyện Đông Giang"
564705,ÐLBD Khu 4,"Khu 4, Thị Trấn Ái Nghĩa, Huyện Đại Lộc"
564790,GD cấp 3 Hà Nha,"Thôn Hà Nha, Xã Đại Đồng, Huyện Đại Lộc"
564530,BĐVHX Điện Minh,"Thôn Bồng Lai, Xã Điện Minh, Huyện Điện Bàn"
564270,BĐVHX Điện Dương,"Thôn Hà My Trung, Xã Điện Dương, Huyện Điện Bàn"
563800,GD cấp 2 Hội An,"4B Đường Trần Hưng Đạo, Phường Minh An, Thị xã Hội An"
564420,GD cấp 3 Phong Thử,"Thôn Phong Thử 1, Xã Điện Thọ, Huyện Điện Bàn"
564631,ÐLBD Điện Nam,"Thôn 1, Xã Điện Nam Bắc, Huyện Điện Bàn"
565146,ÐLBD Phước Đức,"Thôn 5, Xã Phước Đức, Huyện Phước Sơn"
566060,BĐVHX Cha Vàl,"Thôn A Bát, Xã Cha Vàl, Huyện Nam Giang"
565120,BĐVHX Phước Hiệp,"Thôn 11, Xã Phước Hiệp, Huyện Phước Sơn"