562520,BĐVHX Tam Mỹ,"Thôn Đa Phú 1, Xã Tam Mỹ, Huyện Núi Thành"
562540,BĐVHX Tam Trà,"Thôn 3, Xã Tam Trà, Huyện Núi Thành"
563490,BĐVHX Phước Gia,"Thôn 3, Xã Phước Gia, Huyện Hiệp Đức"
562086,BĐVHX Tiên Sơn,"Thôn 3, Xã Tiên Sơn, Huyện Tiên Phước"
561010,GD cấp 3 Huỳnh Thúc Kháng,"206 Đường Huỳnh Thúc Kháng, Phường An Xuân, Thành phố Tam Kỳ"
561100,GD cấp 3 Phan Chu Trinh,"Khối Lê Hồng Phong, Phường Hoà Hương, Thành phố Tam Kỳ"
562106,BĐVHX Tiên Hà,"Thôn Phú Vinh, Xã Tiên Hà, Huyện Tiên Phước"
562510,BĐVHX Tam Sơn,"Thôn 1 (thôn Mỹ Đông), Xã Tam Sơn, Huyện Núi Thành"
561780,BĐVHX Bình Quế,"Thôn Bình Quang, Xã Bình Quế, Huyện Thăng Bình"
561740,BĐVHX Bình Lãnh,"Thôn Nam Bình Sơn, Xã Bình Lãnh, Huyện Thăng Bình"
562500,BĐVHX Tam Thạnh,"Thôn 2, Xã Tam Thạnh, Huyện Núi Thành"
561203,ÐLBD Phan Chu Trinh 1,"Đường Phan Chu Trinh, Phường Phước Hoà, Thành phố Tam Kỳ"
561311,ÐLBD Thương Mại 1,"Khối 10, Phường An Mỹ, Thành phố Tam Kỳ"
561350,GD cấp 3 An Mỹ,"97 Đường Nguyễn Duy Hiệu, Phường An Mỹ, Thành phố Tam Kỳ"
563644,BĐVHX Trà Kót,"Thôn 2, Xã Trà Kót, Huyện Bắc Trà My"
563912,ÐLBD Hai Bà Trưng,"45B Đường Nhị Trưng, Phường Cẩm Phô, Thị xã Hội An"
564244,ÐLBD Lai Nghi,"Thôn 7 A, Xã Điện Nam Đông, Huyện Điện Bàn"
563600,GD cấp 2 Bắc Trà My,"Khối Đồng Bàu, Thị Trấn Trà My, Huyện Bắc Trà My"
561001,ÐLBD Cây Hoa Sữa,"53 Đường Huỳnh Thúc Kháng, Phường An Xuân, Thành phố Tam Kỳ"
561220,GD cấp 3 Bắc Hùng Vương,"Dãy nhà A, Khu dân cư Bưu Điện, Phường Tân Thạnh, Thành phố Tam Kỳ"
561600,GD cấp 2 Thăng Bình,"Khu phố 2, Thị Trấn Hà Lam, Huyện Thăng Bình"
563230,BĐVHX Quế Phước,"Thôn 3(thôn Phú Gia 1), Xã Quế Phước, Huyện Quế Sơn"
564280,GD cấp 3 Khu Công Nghiệp Điện Nam Điện Ngọc,"Lô Hành Chính, Khu công nghiệp Điện Nam -điện Ngọc, Xã Điện Ngọc, Huyện Điện Bàn"
561720,BĐVHX Bình Định Bắc,"Thôn 3 - Làng Đồng Dương-làng Thọ An-làng Bình Lâm, Xã Bình Định, Huyện Thăng Bình"
562040,BĐVHX Tiên Phong,"Thôn 3, Xã Tiên Phong, Huyện Tiên Phước"
562310,KT cấp 2 Núi Thành,"Khối 3, Thị Trấn Núi Thành, Huyện Núi Thành"
562830,GD cấp 3 Kiểm Lâm,"Thôn La Tháp Tây, Xã Duy Hòa, Huyện Duy Xuyên"
562413,GD cấp 3 Khu Công Nghiệp Tam Hiệp,"Thôn 3, Xã Tam Hiệp, Huyện Núi Thành"
562870,BĐVHX Duy Thu,"Thôn Phú Đa 2, Xã Duy Thu, Huyện Duy Xuyên"
563460,BĐVHX Hiệp Hòa,"Thôn 3, Xã Hiệp Hoà, Huyện Hiệp Đức"
562401,ÐLBD Tam Hiệp,"Thôn 9, Xã Tam Hiệp, Huyện Núi Thành"
562710,GD cấp 3 Cầu Chìm,"Khối Phố Mỹ Hòa, Thị Trấn Nam Phước, Huyện Duy Xuyên"
563000,GD cấp 2 Quế Sơn,"Thôn Thuận An, Thị Trấn Đông Phú, Huyện Quế Sơn"
563971,BĐVHX Cẩm Hà,"Khối 3, Phường Thanh Hà, Thị xã Hội An"
561690,BĐVHX Bình Giang,"Thôn 3 (làng Bình Túy), Xã Bình Giang, Huyện Thăng Bình"
562050,BĐVHX Tiên Mỹ,"Thôn 3, Xã Tiên Mỹ, Huyện Tiên Phước"
563001,ÐLBD Chợ Đông Phú,"Thôn Lãnh Thượng 2, Thị Trấn Đông Phú, Huyện Quế Sơn"
563121,BĐVHX Quế Xuân,"Thôn Phú Bình, Xã Quế Xuân 2, Huyện Quế Sơn"
562309,ÐLBD Khối 5,"Khối 5, Thị Trấn Núi Thành, Huyện Núi Thành"
562450,BĐVHX Tam Xuân Ii,"Thôn Bà Bầu, Xã Tam Xuân 2, Huyện Núi Thành"
562360,BĐVHX Tam Hòa,"Thôn Hòa Xuân, Xã Tam Hoà, Huyện Núi Thành"
563470,BĐVHX Quế Bình,"Thôn 2, Xã Quế Bình, Huyện Hiệp Đức"
564213,ÐLBD Vĩnh Điện V,"Khối 7, Thị Trấn Vĩnh Điện, Huyện Điện Bàn"
562400,GD cấp 2 Khu Kinh Tế Mở Chu Lai,"Thôn An Hải, Xã Tam Quang, Huyện Núi Thành"
563047,Kiốt bưu điện Quế Sơn,"Thôn 6, Xã Quế Thuận, Huyện Quế Sơn"
563871,ÐLBD Tân An,"42B Đường Lê Hồng Phong, Phường Tân An, Thị xã Hội An"
561120,BĐVHX Tam Phú,"Thôn Phú Thạnh, Xã Tam Phú, Thành phố Tam Kỳ"
562320,BĐVHX Tam Giang,"Thôn 4, Xã Tam Giang, Huyện Núi Thành"
562781,BĐVHX Duy Vinh,"Thôn Vĩnh Nam (thôn 2), Xã Duy Vinh, Huyện Duy Xuyên"
561090,GD cấp 3 Nam Hùng Vương,"Khối 7, Phường An Sơn, Thành phố Tam Kỳ"
562170,BĐVHX Tiên An,"Thôn 3, Xã Tiên An, Huyện Tiên Phước"
562420,GD cấp 3 Diêm Phổ,"Thôn Diêm Phổ, Xã Tam Anh, Huyện Núi Thành"
563070,BĐVHX Quế Cường,"Thôn 2, Xã Quế Cường, Huyện Quế Sơn"
563150,BĐVHX Quế Hiệp,"Thôn Nghi Trung, Xã Quế Hiệp, Huyện Quế Sơn"
564350,BĐVHX Điện Hòa,"Xóm Bùng, Xã Điện Hoà, Huyện Điện Bàn"
565364,BĐVHX Trà Leng,"Thôn 3, Xã Trà Leng, Huyện Nam Trà My"
561770,BĐVHX Bình Phú,"Thôn Lý Trường, Xã Bình Phú, Huyện Thăng Bình"
563250,BĐVHX Quế An,"Thôn Thắng Đông 1, Xã Quế An, Huyện Quế Sơn"
563720,BĐVHX Trà Ka,"Thôn 2, Xã Trà Ka, Huyện Bắc Trà My"
565140,BĐVHX Phước Đức,"Thôn 5, Xã Phước Đức, Huyện Phước Sơn"
565558,BĐVHX Kà Dăng,"Thôn Hiệp, Xã Kà Dăng, Huyện Đông Giang"
561310,ÐLBD 37 Hùng Vương,"37 Đường Hùng Vương, Phường An Mỹ, Thành phố Tam Kỳ"
561210,GD cấp 3 An Xuân,"02 Đường Phan Bội Châu, Phường Tân Thạnh, Thành phố Tam Kỳ"
563180,GD cấp 3 Trung Phước,"Thôn Trung Phước 1, Xã Quế Trung, Huyện Quế Sơn"
563951,ÐLBD Cẩm Phô Ii,"31 Đường Lê Hồng Phong, Phường Cẩm Phô, Thị xã Hội An"
562561,ÐLBD Tam Nghĩa,"Thôn Định Phước, Xã Tam Nghĩa, Huyện Núi Thành"
562570,GD cấp 3 Nam Chu Lai,"Thôn Hòa Vân, Xã Tam Nghĩa, Huyện Núi Thành"
561670,BĐVHX Bình Minh,"Thôn Hà Bình, Xã Bình Minh, Huyện Thăng Bình"
563400,GD cấp 2 Hiệp Đức,"Thôn 1, Thị Trấn Tân An, Huyện Hiệp Đức"
562060,KT cấp 2 Tiên Phước,"Khu phố Tiên Bình, Thị Trấn Tiên Kỳ, Huyện Tiên Phước"
562116,BĐVHX Tiên Ngọc,"Thôn 4, Xã Tiên Ngọc, Huyện Tiên Phước"
562301,ÐLBD An Tân,"Khối 5, Thị Trấn Núi Thành, Huyện Núi Thành"
562831,BĐVHX Duy Hòa,"Thôn La Tháp Tây, Xã Duy Hòa, Huyện Duy Xuyên"
563650,BĐVHX Trà Đông,"Thôn 7, Xã Trà Đông, Huyện Bắc Trà My"
562850,BĐVHX Duy Tân,"Thôn Thu Bồn Đông, Xã Duy Tân, Huyện Duy Xuyên"
561620,BĐVHX Bình Phục,"Thôn 2 (làng Tất Viên), Xã Bình Phục, Huyện Thăng Bình"
562090,BĐVHX Tiên Châu,"Thôn Hội An, Xã Tiên Châu, Huyện Tiên Phước"
563421,BĐVHX Bình Lâm,"Thôn Hương Phố, Xã Bình Lâm, Huyện Hiệp Đức"
563610,KT cấp 2 Bắc Trà My,"Khối Đồng Bàu, Thị Trấn Trà My, Huyện Bắc Trà My"
561130,KT cấp 2 Thành Phố Tam Kỳ Gd,"18 Đường Trần Cao Vân, Phường An Xuân, Thành phố Tam Kỳ"
561710,BĐVHX Bình Quý,"Thôn Quí Phước, Xã Bình Quý, Huyện Thăng Bình"
561660,BĐVHX Bình Đào,"Thôn 1 ( Làng Trà Đóa 1), Xã Bình Đào, Huyện Thăng Bình"
561602,ÐLBD Hà Lam,"Khu phố 2, Thị Trấn Hà Lam, Huyện Thăng Bình"
561680,BĐVHX Bình Nguyên,"Thôn Thanh Ly 1, Xã Bình Nguyên, Huyện Thăng Bình"
561810,GD cấp 3 Kế Xuyên,"Thôn 4 (kế Xuyên), Xã Bình Trung, Huyện Thăng Bình"
562480,GD cấp 3 Bà Bầu,"Thôn 6, Xã Tam Xuân 1, Huyện Núi Thành"
563160,BĐVHX Quế Long,"Thôn 3, Xã Quế Long, Huyện Quế Sơn"
563200,BĐVHX Quế Phong,"Thôn Tân Phong, Xã Quế Phong, Huyện Quế Sơn"
561380,BĐVHX Tam Ngọc,"Thôn 3, Xã Tam Ngọc, Thành phố Tam Kỳ"
562780,BĐVHX Duy Vinh 1,"Thôn Hà Thuận (thôn 4b), Xã Duy Vinh, Huyện Duy Xuyên"
563270,BĐVHX Quế Minh,"Thôn Đại Lộc, Xã Quế Minh, Huyện Quế Sơn"
563911,ÐLBD Viễn Châu Iii,"34 Đường Nguyễn Trường Tộ, Phường Cẩm Phô, Thị xã Hội An"
561061,ÐLBD An Sơn,"Khối 7, Phường An Sơn, Thành phố Tam Kỳ"
563634,BĐVHX Trà Nú,"Thôn 2, Xã Trà Nú, Huyện Bắc Trà My"
563981,BĐVHX Thanh Hà,"Khối 8, Phường Thanh Hà, Thị xã Hội An"
564810,GD cấp 3 Hà Tân,"Thôn Hà Tân, Xã Đại Lãnh, Huyện Đại Lộc"
561640,BĐVHX Bình Hải,"Thôn Hiệp Hưng, Xã Bình Hải, Huyện Thăng Bình"
561212,ÐLBD Nguyễn Chí Thanh,"Đường Nguyễn Chí Thanh, Phường Tân Thạnh, Thành phố Tam Kỳ"
561820,GD cấp 3 Quán Gò,"Thôn An Thành 2, Xã Bình An, Huyện Thăng Bình"
562860,GD cấp 3 Mỹ Sơn,"Thôn Mỹ Sơn, Xã Duy Phú, Huyện Duy Xuyên"
563520,BĐVHX Sông Trà,"Thôn 3, Xã Sông Trà, Huyện Hiệp Đức"
566094,BĐVHX Đắc Pre,"Thôn 56b, Xã Đac Pree, Huyện Nam Giang"
561630,BĐVHX Bình Sa,"Thôn 3 (làng Bình Trúc 1), Xã Bình Sa, Huyện Thăng Bình"
564441,ÐLBD Lạc Thành,"Thôn 5b, Xã Điện Hồng, Huyện Điện Bàn"
564703,ÐLBD Khu 2,"Khu 2, Thị Trấn Ái Nghĩa, Huyện Đại Lộc"
565590,BĐVHX Tư,"Thôn Láy, Xã Tư, Huyện Đông Giang"
566111,BĐVHX Cà Dy,"Thôn Pà Dồn, Xã Cà Dy, Huyện Nam Giang"
562573,BĐVHX Tam Nghĩa,"Thôn Định Phước, Xã Tam Nghĩa, Huyện Núi Thành"
564050,BĐVHX Tân Hiệp,"Thôn Cấm, Xã Tân Hiệp, Thị xã Hội An"
563952,ÐLBD Huỳnh Thúc Kháng,"51B Đường Hùng Vương, Phường Cẩm Phô, Thị xã Hội An"
561060,ÐLBD Vườn Lài,"233B Đường Trần Cao Vân, Phường An Sơn, Thành phố Tam Kỳ"
563821,ÐLBD Sơn Phô,"Khối Sơn Phô 2, Phường Cẩm Châu, Thị xã Hội An"
561610,KT cấp 2 Thăng Bình,"Khu phố 2, Thị Trấn Hà Lam, Huyện Thăng Bình"
562070,BĐVHX Tiên Cẩm,"Thôn Cẩm Tây, Xã Tiên Cẩm, Huyện Tiên Phước"
562348,BĐVHX Tam Hải,"Thôn 2, Xã Tam Hải, Huyện Núi Thành"
562730,BĐVHX Duy Thành,"Thôn 2 (thôn Thi Thại), Xã Duy Thành, Huyện Duy Xuyên"
562810,BĐVHX Duy Châu,"Thôn Lệ An, Xã Duy Châu, Huyện Duy Xuyên"
563626,BĐVHX Trà Giang,"Thôn 1, Xã Trà Giang, Huyện Bắc Trà My"
562560,GD cấp 3 Bến Xe,"Thôn Định Phước, Xã Tam Nghĩa, Huyện Núi Thành"
564200,GD cấp 2 Điện Bàn,"Khối 2, Thị Trấn Vĩnh Điện, Huyện Điện Bàn"
564930,BĐVHX Đại Cường,"Thôn Thanh Vân, Xã Đại Cương, Huyện Đại Lộc"
566360,BĐVHX Tam Phước,"Thôn Cẩm Khê, Xã Tam Phước, Huyện Phú Ninh"
564220,GD cấp 3 Điện Phương,"Thôn Thanh Chiêm 1, Xã Điện Phương, Huyện Điện Bàn"
565150,BĐVHX Phước Năng,"Thôn 2 (thôn Plây Khôn), Xã Phước Năng, Huyện Phước Sơn"
564456,ÐLBD Điện Hồng,"Thôn 12, Xã Điện Hồng, Huyện Điện Bàn"
564730,BĐVHX Đại Hiệp,"Thôn Tích Phú, Xã Đại Hiệp, Huyện Đại Lộc"
564750,BĐVHX Đại Nghĩa,"Thôn Đức Hòa, Xã Đại Nghĩa, Huyện Đại Lộc"
565160,BĐVHX Phước Mỹ,"Thôn 2 (làng Mừng), Xã Phước Mỹ, Huyện Phước Sơn"
566110,GD cấp 3 Bến Giằng,"Thôn Crung, Xã Cà Dy, Huyện Nam Giang"
561000,GD cấp 2 Thành Phố Tam Kỳ Gd,"18 Đường Trần Cao Vân, Phường An Xuân, Thành phố Tam Kỳ"
561160,BĐVHX Tam Thăng,"Thôn Vĩnh Bình, Xã Tam Thăng, Thành phố Tam Kỳ"
563510,BĐVHX Thăng Phước,"Thôn 2, Xã Thăng Phước, Huyện Hiệp Đức"
565400,KT cấp 2 Nam Trà My,"Thôn 1, Xã Trà Mai, Huyện Nam Trà My"
565610,BĐVHX Sông Kôn,"Thôn Bền, Xã Sông Kôn, Huyện Đông Giang"
562190,BĐVHX Tiên Lập,"Thôn 2, Xã Tiên Lập, Huyện Tiên Phước"
564700,GD cấp 2 Đại Lộc,"Khu 2, Thị Trấn Ái Nghĩa, Huyện Đại Lộc"
562380,BĐVHX Tam Tiến,"Thôn Tân Bình Trung, Xã Tam Tiến, Huyện Núi Thành"
564230,KT cấp 2 Điện Bàn,"Khối 2, Thị Trấn Vĩnh Điện, Huyện Điện Bàn"
562020,GD cấp 3 Tiên Thọ,"Thôn 3, Xã Tiên Thọ, Huyện Tiên Phước"
563530,KT cấp 2 Hiệp Đức,"Thôn 1, Thị Trấn Tân An, Huyện Hiệp Đức"
564380,BĐVHX Điện Tiến,"Thôn Thái Sơn 1, Xã Điện Tiến, Huyện Điện Bàn"
564401,ÐLBD Phong Nhị,"Thôn Phong Nhị, Xã Điện An, Huyện Điện Bàn"
564472,ÐLBD Nông Sơn,"Thôn Nông Sơn 2, Xã Điện Phước, Huyện Điện Bàn"
562000,GD cấp 2 Tiên Phước,"Khu phố Tiên Bình, Thị Trấn Tiên Kỳ, Huyện Tiên Phước"
562120,BĐVHX Tiên Lãnh,"Thôn 10, Xã Tiên Lãnh, Huyện Tiên Phước"
562700,GD cấp 2 Duy Xuyên,"Khối Phố Long Xuyên 3 (đội 4), Thị Trấn Nam Phước, Huyện Duy Xuyên"
566036,BĐVHX La Êê,"Thôn Ba Lan, Xã La Êê, Huyện Nam Giang"
563440,BĐVHX Quế Thọ,"Thôn Phú Bình, Xã Quế Thọ, Huyện Hiệp Đức"
566080,BĐVHX La Dêê,"Thôn Đắc Ốc, Xã La Dêê, Huyện Nam Giang"
564471,ÐLBD Ga Nông Sơn,"Thôn Nông Sơn 1, Xã Điện Phước, Huyện Điện Bàn"
565800,GD cấp 2 Tây Giang,"Thôn Nal, Xã Lăng, Huyện Tây Giang"
564920,BĐVHX Đại Thạnh,"Thôn Tây Lễ, Xã Đại Thạnh, Huyện Đại Lộc"
562410,GD cấp 3 Chợ Trạm,"Thôn 9, Xã Tam Hiệp, Huyện Núi Thành"
563101,ÐLBD Quế Phú,"Thôn Thương Nghiệp, Xã Quế Phú, Huyện Quế Sơn"
563080,GD cấp 3 Hương An,"Thôn Thương Nghiệp, Xã Quế Phú, Huyện Quế Sơn"
563480,BĐVHX Quế Lưu,"Thôn 2, Xã Quế Lưu, Huyện Hiệp Đức"
564860,BĐVHX Đại Tân,"Thôn Xuân Tây, Xã Đại Tân, Huyện Đại Lộc"
564281,ÐLBD Câu Hà Ii,"Thôn Câu Hà, Xã Điện Ngọc, Huyện Điện Bàn"
564030,BĐVHX Cẩm Kim,"Thôn Trung Hà, Xã Cẩm Kim, Thị xã Hội An"
564221,ÐLBD Cầu Mống,"Thôn Thanh Chiêm 1, Xã Điện Phương, Huyện Điện Bàn"
564910,BĐVHX Đại Chánh,"Thôn Đại Khương, Xã Đại Chánh, Huyện Đại Lộc"
566050,KT cấp 2 Nam Giang,"Thôn Dung, Thị Trấn Thạnh Mỹ, Huyện Nam Giang"
565110,KT cấp 2 Phước Sơn,"Khối 4, Thị Trấn Khâm Đức, Huyện Phước Sơn"
561811,ÐLBD Bình Trung,"Thôn 4 (kế Xuyên), Xã Bình Trung, Huyện Thăng Bình"
562370,KT cấp 2 Khu Kinh Tế Mở Chu Lai,"Thôn An Hải, Xã Tam Quang, Huyện Núi Thành"
564212,ÐLBD Vĩnh Điện IV,"Khối 3, Thị Trấn Vĩnh Điện, Huyện Điện Bàn"
562880,GD cấp 3 Trà Kiệu,"Thôn Trà Châu, Xã Duy Sơn, Huyện Duy Xuyên"
564040,BĐVHX Cẩm Nam,"Thôn Châu Trung, Xã Cẩm Nam, Thị xã Hội An"
564421,BĐVHX Điện Thọ,"Thôn La Trung, Xã Điện Thọ, Huyện Điện Bàn"
564414,ÐLBD Bằng An,"Thôn Bằng An Tây, Xã Điện An, Huyện Điện Bàn"
563220,BĐVHX Quế Ninh,"Thôn Khánh Bình, Xã Quế Ninh, Huyện Quế Sơn"
563660,BĐVHX Trà Dương,"Thôn 2, Xã Trà Dương, Huyện Bắc Trà My"
563879,ÐLBD Ngô Sỹ Liên,"Khối Tân Hòa, Phường Tân An, Thị xã Hội An"
564204,ÐLBD Phương Thảo,"Khối 6, Thị Trấn Vĩnh Điện, Huyện Điện Bàn"
561650,BĐVHX Bình Triều,"Thôn Phước Ấm (thôn 3), Xã Bình Triều, Huyện Thăng Bình"
564830,GD cấp 3 Đại Minh,"Thôn Đông Gia, Xã Đại Minh, Huyện Đại Lộc"
566260,GD cấp 3 Chiên Đàn,"Thôn Đàn Hạ, Xã Tam Đàn, Huyện Phú Ninh"
562760,BĐVHX Duy Phước,"Thôn Mỹ Phước, Xã Duy Phước, Huyện Duy Xuyên"
564381,ÐLBD Cẩm Lý,"Thôn Châu Bí 5, Xã Điện Tiến, Huyện Điện Bàn"
563910,ÐLBD Cẩm Phô,"47A Đường Lê Hồng Phong, Phường Cẩm Phô, Thị xã Hội An"
,,
564202,ÐLBD Vĩnh Điện,"Khối 4, Thị Trấn Vĩnh Điện, Huyện Điện Bàn"
564290,GD cấp 3 Điện Ngọc,"Thôn Ngọc Vinh, Xã Điện Ngọc, Huyện Điện Bàn"
564791,BĐVHX Đại Đồng,"Thôn Lộc Phước, Xã Đại Đồng, Huyện Đại Lộc"
561760,BĐVHX Bình Chánh,"Tổ Trung Tâm, Xã Bình Chánh, Huyện Thăng Bình"
563010,GD cấp 3 Sơn Châu,"Thôn Cang Tây, Thị Trấn Đông Phú, Huyện Quế Sơn"
563170,BĐVHX Quế Lộc,"Thôn Lộc Đông, Xã Quế Lộc, Huyện Quế Sơn"
563990,ÐLBD Phan Chu Trinh,"89 Đường Phan Chu Trinh, Phường Minh An, Thị xã Hội An"
565310,BĐVHX Trà Dơn,"Thôn 6, Xã Trà Dơn, Huyện Nam Trà My"
563081,ÐLBD Mộc Bài,"Thôn 10, Xã Quế Phú, Huyện Quế Sơn"
565570,GD cấp 3 Quyết Thắng,"Thôn Ban Mai 1, Xã Ba, Huyện Đông Giang"
560000,QUANG NAM,"18 Trần Cao Vân, phường An Xuân, TX Tam Kỳ"
562701,ÐLBD Mỹ Hạt,"Thôn Mỹ Hạt, Thị Trấn Nam Phước, Huyện Duy Xuyên"
565840,GD cấp 3 Azứt,"Thôn A Ung, Xã BHa Lêê, Huyện Tây Giang"
561790,BĐVHX Bình Tú,"Thôn Phước Cẩm, Xã Bình Tú, Huyện Thăng Bình"
563710,BĐVHX Trà Giáp,"Thôn 1, Xã Trà Giáp, Huyện Bắc Trà My"
561601,ÐLBD Cây Cốc,"Khu phố 5, Thị Trấn Hà Lam, Huyện Thăng Bình"
562300,GD cấp 2 Núi Thành,"Khối 3, Thị Trấn Núi Thành, Huyện Núi Thành"
562720,KT cấp 2 Duy Xuyên,"Khối Phố Long Xuyên 3 (đội 4), Thị Trấn Nam Phước, Huyện Duy Xuyên"
562740,BĐVHX Duy Nghĩa,"Thôn 3 (làng Hội Sơn), Xã Duy Nghĩa, Huyện Duy Xuyên"
563420,GD cấp 3 Việt An,"Thôn Nhì Đông, Xã Bình Lâm, Huyện Hiệp Đức"
566340,BĐVHX Tam Thành,"Thôn 1, Xã Tam Thành, Huyện Phú Ninh"
561840,BĐVHX Bình Nam,"Thôn Nghĩa Hòa, Xã Bình Nam, Huyện Thăng Bình"
565100,GD cấp 2 Phước Sơn,"Khối 4, Thị Trấn Khâm Đức, Huyện Phước Sơn"
564651,GD cấp 3 Hà My,"Thôn 1a, Xã Điện Dương, Huyện Điện Bàn"
563870,GD cấp 3 Lê Hồng Phong,"Khối Tân Thanh, Phường Tân An, Thị xã Hội An"
563670,BĐVHX Trà Tân,"Thôn 1, Xã Trà Tân, Huyện Bắc Trà My"
564850,BĐVHX Đại Phong,"Thôn Mỹ Hảo, Xã Đại Phong, Huyện Đại Lộc"
562180,BĐVHX Tiên Lộc,"Thôn 2, Xã Tiên Lộc, Huyện Tiên Phước"
564241,ÐLBD Thương Tín,"Thôn 7 A, Xã Điện Nam Đông, Huyện Điện Bàn"
561730,BĐVHX Bình Trị,"Thôn Châu Lâm(làng Nho Lâm, Châu Đức, Châu Nho), Xã Bình Trị, Huyện Thăng Bình"
563030,KT cấp 2 Quế Sơn,"Thôn Thuận An, Thị Trấn Đông Phú, Huyện Quế Sơn"
563830,KT cấp 2 Hội An,"4B Đường Trần Hưng Đạo, Phường Minh An, Thị xã Hội An"
564203,ÐLBD Vĩnh Điện Ii,"Khối 2, Thị Trấn Vĩnh Điện, Huyện Điện Bàn"
562901,ÐLBD Trung Đông,"Thôn Trung Đông (thôn 6), Xã Duy Trung, Huyện Duy Xuyên"
563840,BĐVHX Cẩm Thanh,"Thôn 6, Xã Cẩm Thanh, Thị xã Hội An"
564470,BĐVHX Điện Phước,"Thôn Nhị Dinh 1, Xã Điện Phước, Huyện Điện Bàn"
564590,BĐVHX Thanh Quýt,"Thôn Thanh Quýt 4, Xã Điện Thắng Trung, Huyện Điện Bàn"
564732,ÐLBD Chợ Đại Hiệp,"Thôn Phú Đông, Xã Đại Hiệp, Huyện Đại Lộc"
565101,ÐLBD Thủy Tiên,"Khối 7, Thị Trấn Khâm Đức, Huyện Phước Sơn"
564570,GD cấp 3 Điện Thắng,"Thôn Bồ Mưng 2, Xã Điện Thắng Bắc, Huyện Điện Bàn"
565876,BĐVHX A Tiêng,"Thôn Ahu, Xã A Tiêng, Huyện Tây Giang"
563820,BĐVHX Cẩm Châu,"Khối Thanh Tây, Phường Cẩm Châu, Thị xã Hội An"
564400,BĐVHX Điện An,"Thôn Phong Nhất, Xã Điện An, Huyện Điện Bàn"
563410,BĐVHX Bình Sơn,"Thôn 2, Xã Bình Sơn, Huyện Hiệp Đức"
565343,BĐVHX Trà Don,"Thôn 2, Xã Trà Don, Huyện Nam Trà My"
561360,ÐLBD Trường Xuân,"Khối 1, Phường Trường Xuân, Thành phố Tam Kỳ"
562882,ÐLBD Trà Kiệu,"Thôn Trà Châu, Xã Duy Sơn, Huyện Duy Xuyên"
564704,ÐLBD Ái Nghĩa,"Khu 7, Thị Trấn Ái Nghĩa, Huyện Đại Lộc"
566104,BĐVHX Đắc Pring,"Thôn 49b, Xã Đac Pring, Huyện Nam Giang"
563500,BĐVHX Phước Trà,"Thôn 5, Xã Phước Trà, Huyện Hiệp Đức"
563020,ÐLBD Quế Châu,"Thôn 4, Xã Quế Châu, Huyện Quế Sơn"
564720,KT cấp 2 Đại Lộc,"Khu 2, Thị Trấn Ái Nghĩa, Huyện Đại Lộc"
564811,ÐLBD Đại Lãnh,"Thôn Hà Tân, Xã Đại Lãnh, Huyện Đại Lộc"
564591,ÐLBD Thanh Quýt,"Thôn Thanh Quýt 1, Xã Điện Thắng Trung, Huyện Điện Bàn"
566280,BĐVHX Tam An,"Thôn An Mỹ 2, Xã Tam An, Huyện Phú Ninh"
562140,BĐVHX Tiên Cảnh,"Thôn 5, Xã Tiên Cảnh, Huyện Tiên Phước"
566000,GD cấp 2 Nam Giang,"Thôn Dung, Thị Trấn Thạnh Mỹ, Huyện Nam Giang"
561700,BĐVHX Bình Dương,"Thôn 2 (làng Ấp Nam), Xã Bình Dương, Huyện Thăng Bình"
564731,ÐLBD Đại Hiệp,"Thôn Phú Hải, Xã Đại Hiệp, Huyện Đại Lộc"
563860,BĐVHX Cẩm An,"Khối An Tân, Phường Cẩm An, Thị xã Hội An"
564511,BĐVHX Điện Trung,"Thôn Tân Bình 4, Xã Điện Trung, Huyện Điện Bàn"
565300,GD cấp 2 Nam Trà My,"Thôn 1, Xã Trà Mai, Huyện Nam Trà My"
563700,BĐVHX Trà Giác,"Thôn 1a, Xã Trà Giác, Huyện Bắc Trà My"
565500,GD cấp 2 Đông Giang,"Thôn Ngã Ba, Thị Trấn PRao, Huyện Đông Giang"
564282,ÐLBD Câu Hà,"Thôn Câu Hà, Xã Điện Ngọc, Huyện Điện Bàn"
564201,ÐLBD Vĩnh Điện Iii,"Khối 6, Thị Trấn Vĩnh Điện, Huyện Điện Bàn"
565170,BĐVHX Phước Chánh,"Thôn 2 (thôn Con Ra Ngau), Xã Phước Chánh, Huyện Phước Sơn"
563980,ÐLBD Thanh Hà III,"Khối 1, Phường Thanh Hà, Thị xã Hội An"
564060,GD cấp 3 Cửa Đại,"Khối Phước Tân, Phường Cửa Đại, Thị xã Hội An"
566201,BĐVHX Tam Lãnh,"Thôn An Lâu 1, Xã Tam Lãnh, Huyện Phú Ninh"
565660,GD cấp 3 A Xờ,"Thôn A Xờ, Xã Ma Cooih, Huyện Đông Giang"
564610,BĐVHX Cẩm Sa,"Thôn 4, Xã Điện Nam Trung, Huyện Điện Bàn"
563120,GD cấp 3 Bà Rén,"Thôn 2, Xã Quế Xuân 1, Huyện Quế Sơn"
564701,BĐVHX Đại Sơn,"Khu 1, Thị Trấn Ái Nghĩa, Huyện Đại Lộc"
562160,BĐVHX Tiên Hiệp,"Thôn 4, Xã Tiên Hiệp, Huyện Tiên Phước"
564702,ÐLBD Khu 5,"Khu 5, Thị Trấn Ái Nghĩa, Huyện Đại Lộc"
566250,KT cấp 2 Phú Ninh,"Thôn Đàn Hạ, Xã Tam Đàn, Huyện Phú Ninh"
565190,BĐVHX Phước Công,"Thôn 1 (thôn Công Tơ Năng Trên), Xã Phước Công, Huyện Phước Sơn"
561211,ÐLBD Phan Bội Châu,"Đường Phan Bội Châu, Phường Tân Thạnh, Thành phố Tam Kỳ"
564283,ÐLBD Ngọc Vinh,"Thôn Ngọc Vinh, Xã Điện Ngọc, Huyện Điện Bàn"
564639,ÐLBD Điện Nam Bắc,"Thôn 2a, Xã Điện Nam Bắc, Huyện Điện Bàn"
563450,BĐVHX Hiệp Thuận,"Thôn 2, Xã Hiệp Thuận, Huyện Hiệp Đức"
564630,ÐLBD Điện Nam Ii,"Thôn 1, Xã Điện Nam Bắc, Huyện Điện Bàn"
565650,BĐVHX Zà Hung,"Thôn A Xanh 2, Xã Za Hung, Huyện Đông Giang"
564510,BĐVHX Điện Trung 2,"Thôn Nam Hà 2, Xã Điện Trung, Huyện Điện Bàn"
566012,ÐLBD Thành Mỹ,"Thôn Thành Mỹ 2, Thị Trấn Thạnh Mỹ, Huyện Nam Giang"
564550,BĐVHX Điện Phong,"Thôn Tân Thành, Xã Điện Phong, Huyện Điện Bàn"
564770,BĐVHX Đại Quang,"Thôn Hòa Thạch, Xã Đại Quang, Huyện Đại Lộc"
565810,KT cấp 2 Tây Giang,"Thôn Nal, Xã Lăng, Huyện Tây Giang"
565000,BĐVHX Đại Hưng,"Thôn Trúc Hà, Xã Đại Hưng, Huyện Đại Lộc"
562800,BĐVHX Duy Trinh,"Thôn Phú Bông (thôn 3), Xã Duy Trinh, Huyện Duy Xuyên"
563685,BĐVHX Trà Đốc,"Thôn 1, Xã Trà Đốc, Huyện Bắc Trà My"
565213,GD cấp 3 Phước Xuân,"Thôn Lao Mưng, Xã Phước Xuân, Huyện Phước Sơn"
566329,ÐLBD Tam Vinh 1,"Thôn Đức Thạnh, Xã Tam Vinh, Huyện Phú Ninh"
566320,BĐVHX Tam Vinh,"Thôn Tú Lâm, Xã Tam Vinh, Huyện Phú Ninh"
563050,BĐVHX Phú Thọ,"Thôn 2, Xã Phú Thọ, Huyện Quế Sơn"
565200,BĐVHX Phước Kim,"Làng Luông A, Xã Phước Kim, Huyện Phước Sơn"
565375,BĐVHX Trà Nam,"Thôn 3, Xã Trà Nam, Huyện Nam Trà My"
566200,GD cấp 2 Phú Ninh,"Thôn Đàn Hạ, Xã Tam Đàn, Huyện Phú Ninh"
564351,ÐLBD Bích Bắc,"Thôn Bích Bắc, Xã Điện Hoà, Huyện Điện Bàn"
564490,BĐVHX Điện Quang,"Thôn Bảo An Tây, Xã Điện Quang, Huyện Điện Bàn"
564284,ÐLBD Ngân Trung,"Thôn Ngân Trung, Xã Điện Ngọc, Huyện Điện Bàn"
562881,BĐVHX Duy Sơn,"Thôn Chiêm Sơn, Xã Duy Sơn, Huyện Duy Xuyên"
564242,ÐLBD Điện Nam Iii,"Thôn 7 A, Xã Điện Nam Đông, Huyện Điện Bàn"
562900,BĐVHX Duy Trung,"Thôn Hòa Nam (thôn 3), Xã Duy Trung, Huyện Duy Xuyên"
564870,BĐVHX Đại Hồng,"Thôn Phước Lâm, Xã Đại Hồng, Huyện Đại Lộc"
564950,GD cấp 3 Gia Cốc,"Thôn Phú An, Xã Đại Thắng, Huyện Đại Lộc"
